movie_id,title,year,genres,runtime_min,audio_language,age_rating_tw,poster_url,synopsis
1001,排球少年!! 垃圾場的決戰 (Haikyu!! The Dumpster Battle),2024,"""動畫,運動,劇情""",85,JP,保護級,https://encrypted-tbn0.gstatic.com/images?q=tbn:ANd9GcTCkB482HikU0knqhk_4GBfc1qv9ZYvJz0BIA&s,烏野高中與音駒高中在全國大賽的宿命對決，這是他們多年友情與競爭的總結之戰。
1002,阿凡達3：火與灰 (Avatar: Fire and Ash),2025,"""動作,奇幻,科幻""",192,EN,保護級,https://encrypted-tbn0.gstatic.com/images?q=tbn:ANd9GcRLTODviV50kZpRsI3JPqOgWJRtK481npLrNA&s,潘朵拉的故事進入新章，納美人面臨火之族的威脅與人類再次入侵的危機。
1003,一戰再戰 (Once More Into the War),2023,"""喜劇,劇情""",170,EN,普遍級,https://www.vscinemas.com.tw/upload/film/film_20250821007.jpg,一名退伍老兵誤打誤撞再次被徵召，卻意外在戰場上找到新的意義與夥伴。
1004,米奇17號 (Mickey 17),2025,"""科幻,喜劇""",139,EN,輔導級,https://meet.eslite.com/Content/Images/ArtShow/n001_MICKEY17_POSTER_20250217140301.jpg,在遙遠的殖民行星上，一個不死複製人被迫不斷重生以完成危險任務。
1005,徵人啟弒 (No Other Choice),2025,"""喜劇,驚悚""",139,EN,輔導級,https://upload.wikimedia.org/wikipedia/zh/thumb/c/cf/No_Other_Choice.jpg/250px-No_Other_Choice.jpg,當一場徵才活動變成連環殺人陷阱，參與者被迫展開一場驚悚逃亡。
1006,鬼滅之刃劇場版 無限城篇 (Demon Slayer: Infinity Castle),2025,"""動作,冒險,動畫""",155,JP,保護級,https://upload.wikimedia.org/wikipedia/zh/6/60/%E9%AC%BC%E6%BB%85%E4%B9%8B%E5%88%83%E5%8A%87%E5%A0%B4%E7%89%88_%E7%84%A1%E9%99%90%E5%9F%8E%E7%AF%87.jpeg,炭治郎與鬼殺隊進入無限城，迎戰最終的宿敵鬼舞辻無慘。
1007,劇場版 鏈鋸人：蕾潔篇 (Chainsaw Man: Reze Arc),2025,"""恐怖,冒險,動畫""",97,JP,普遍級,https://upload.wikimedia.org/wikipedia/zh/thumb/6/63/Chainsaw_Man_The_Movie_Reze_Arc_Poster.jpg/250px-Chainsaw_Man_The_Movie_Reze_Arc_Poster.jpg,電次遇見神秘少女蕾潔，卻被捲入公安與刺客的血腥戰鬥。
1008,Gunslingers,2025,"""動作,西部,劇情""",104,EN,保護級,https://encrypted-tbn0.gstatic.com/images?q=tbn:ANd9GcTdLpEPQ724GPFghNoLxWwVYeXaQvrl31NMzg&s,一群槍手在荒漠中為了自由與救贖展開最後的對決。
